benchmark_id,source_id,sub_peril_family,metric_family,reported_value,value_basis_label,maps_to_pathway_failure_units,usd_per_MWdc_if_normalizable,pct_installed_TIV_if_normalizable,v1_grain_comparability,v2_grain_comparability,denominator_note
AXIS_FAILED_STOW_PER_MW,AXIS_RENEWABLE_2024,CONVECTIVE_BLENDED,EVENT_LOSS,"$380,000/MW",gross_claim,PV_TRACKER_MODULE_FIELD+PV_TRACKER_SBOS_ASSEMBLY,380000,33.929,LOW_GRAIN_MISMATCH,LOW_GRAIN_MISMATCH_TRACKER_PATHWAY,Tracker pathway (failed-stow is a tracker phenomenon). Uses gust/Ucrit denominator; do not compare to fixed-tilt net-pressure axis.
AXIS_FIXED_TILT_PER_MW,AXIS_RENEWABLE_2024,CONVECTIVE_BLENDED,EVENT_LOSS,"$340,000/MW",gross_claim,PV_FIXED_TILT_MODULE_FIELD+PV_FIXED_TILT_SUPPORT_STRUCTURE,340000,30.357,LOW_GRAIN_MISMATCH,LOW_GRAIN_MISMATCH_FIXED_PATHWAY,Fixed-tilt pathway; net-pressure-ratio denominator. Architecture-appropriate but still blended module+support+BI.
AXIS_SUCCESSFUL_HAIL_STOW_PER_MW,AXIS_RENEWABLE_2024,CONVECTIVE_BLENDED,EVENT_LOSS,"$150,000/MW",gross_claim,PV_TRACKER_MODULE_FIELD (residual),150000,13.393,LOW_GRAIN_MISMATCH,LOW_GRAIN_MISMATCH_TRACKER_PATHWAY,"Tracker successful-hail-stow residual; predominantly hail mitigation, not straight-line wind."
NREL_TIV_CROSSCHECK_112,NREL_DOE_PV_COST_BENCHMARK_Q1_2024,N/A,VALUE_BASIS,$1.12/W-dc,installed_TIV,(denominator cross-check),1120000,100.0,NOT_A_LOSS,NOT_A_LOSS,"TIV basis cross-check, exact match."
PVEL_TRACKER_VS_FIXED_LOAD,PVEL_MSS_SCORECARD_2025,STRAIGHT_LINE_CONVECTIVE,LOAD_RATING,1800 Pa (tracker) / 2400 Pa (fixed),unknown,fixed vs tracker design-pressure split,,,MECHANISM_ONLY,MECHANISM_SUPPORTS_PATHWAY_SPLIT,Lab load ratings (tracker 1800 Pa < fixed 2400 Pa) are the engineering basis for the v2 two-pathway split. Not a loss.
CPP_GALLOPING_ONSET,CPP_TORSIONAL_GALLOPING_2015,STRAIGHT_LINE_CONVECTIVE,INTENSITY,<~40 m/s (~90 mph),unknown,PV_TRACKER_SBOS_ASSEMBLY (Ucrit axis),,,MECHANISM_ONLY,MECHANISM_DEFINES_TRACKER_AXIS,"Galloping onset ~40 m/s defines the tracker Ucrit denominator. System-specific, not a fleet plug-in, not a loss."
NEXTRACKER_STOW_FAILPROB,NEXTRACKER_STOW_WHITEPAPER_2018,STRAIGHT_LINE_CONVECTIVE,FAILURE_PROBABILITY,"1.7-14.6% (25-yr, by site/stow)",unknown,PV_TRACKER_SBOS_ASSEMBLY (probability),,,DAMAGE_STATE_ONLY,PROBABILITY_NOT_DR,25-yr cumulative failure probability; not a single-event state DR. Screening context for tracker pathway.
CEDAR_RAPIDS_DERECHO_LIFTOFF,SETO_SEVERE_WEATHER_2023,STRAIGHT_LINE_CONVECTIVE,DAMAGE_STATE,array liftoff; ~140 mph vs ASCE 120 mph design,unknown,PV_FIXED_TILT_SUPPORT_STRUCTURE / foundation (withheld),,,DAMAGE_STATE_ONLY,DAMAGE_STATE_ONLY,"Ballasted-array derecho liftoff at ~140 mph; damage-state, no $. Foundation FU is WITHHELD in v2."
